{
  "artifact_ref": "models/transport/controls/TR-C01.model.json",
  "artifact_sha256": "84c83fffed8f2e1751aa4ceddcb0421ae46bd1ad28b1dd6a83c725ffd1b44cb2",
  "baseline_ref": "models/transport/TR-POS-01.model.json",
  "checker": {
    "function": "audit_temporal_transport",
    "module": "cst_tt.transport",
    "python_version": "3.13.5",
    "valid_result": false
  },
  "claim_ceiling": "finite structural obligation boundary only",
  "control_id": "TR-C01",
  "control_kind": "transport",
  "expected_primary_failure": "carriers-distinct",
  "observed_failures": [
    "carriers-distinct",
    "target-states-well-formed",
    "target-temporal-witness-valid",
    "mapped-signature-agreement",
    "route-discipline-satisfied",
    "ownership-interface-valid"
  ],
  "result_status": "checked-obligation-countermodel",
  "schema_version": "CST-TT-03"
}
